Entry,Reviewed,Entry Name,Protein names,Gene Names,Organism,Length,Lipidation
Q91ZR1,reviewed,RAB4B_MOUSE,Ras-related protein Rab-4B (EC 3.6.5.2),Rab4b Rab4,Mus musculus (Mouse),213,"LIPID 211; /note=""S-geranylgeranyl cysteine""; /evidence=""ECO:0000250""; LIPID 213; /note=""S-geranylgeranyl cysteine""; /evidence=""ECO:0000250"""
Q921E2,reviewed,RAB31_MOUSE,Ras-related protein Rab-31,Rab31,Mus musculus (Mouse),195,"LIPID 194; /note=""S-geranylgeranyl cysteine""; /evidence=""ECO:0000250""; LIPID 195; /note=""S-geranylgeranyl cysteine""; /evidence=""ECO:0000250"""
Q921J2,reviewed,RHEB_MOUSE,GTP-binding protein Rheb (Ras homolog enriched in brain) (EC 3.6.5.-),Rheb,Mus musculus (Mouse),184,"LIPID 181; /note=""S-farnesyl cysteine""; /evidence=""ECO:0000269|PubMed:16631613"""
Q921M7,reviewed,CYRIB_MOUSE,CYFIP-related Rac1 interactor B (Protein FAM49B),Cyrib Cyri Fam49b,Mus musculus (Mouse),324,"LIPID 2; /note=""N-myristoyl glycine""; /evidence=""ECO:0000250|UniProtKB:Q9NUQ9"""
Q922S4,reviewed,PDE2A_MOUSE,"cGMP-dependent 3',5'-cyclic phosphodiesterase (EC 3.1.4.17) (Cyclic GMP-stimulated phosphodiesterase) (CGS-PDE) (cGSPDE)",Pde2a,Mus musculus (Mouse),939,"LIPID 2; /note=""N-myristoyl glycine""; /evidence=""ECO:0000250|UniProtKB:O00408""; LIPID 5; /note=""S-palmitoyl cysteine""; /evidence=""ECO:0000250|UniProtKB:O00408""; LIPID 11; /note=""S-palmitoyl cysteine""; /evidence=""ECO:0000250|UniProtKB:O00408"""
Q923S6,reviewed,NEUL1_MOUSE,E3 ubiquitin-protein ligase NEURL1 (EC 2.3.2.27) (Neuralized-like protein 1A) (m-neu1) (m-neuralized 1) (Neuralized1) (RING-type E3 ubiquitin transferase NEURL1),Neurl1 Neurl Neurl1a,Mus musculus (Mouse),574,"LIPID 2; /note=""N-myristoyl glycine""; /evidence=""ECO:0000269|PubMed:18077452"""
Q925T6,reviewed,GRIP1_MOUSE,Glutamate receptor-interacting protein 1 (GRIP-1),Grip1,Mus musculus (Mouse),1127,"LIPID Q925T6-2:11; /note=""S-palmitoyl cysteine""; /evidence=""ECO:0000305"""
Q99J93,reviewed,IFM2_MOUSE,Interferon-induced transmembrane protein 2 (Dispanin subfamily A member 2c) (DSPA2c) (Fragilis protein 3),Ifitm2,Mus musculus (Mouse),144,"LIPID 70; /note=""S-palmitoyl cysteine""; /evidence=""ECO:0000250|UniProtKB:Q01629""; LIPID 71; /note=""S-palmitoyl cysteine""; /evidence=""ECO:0000250|UniProtKB:Q01629""; LIPID 104; /note=""S-palmitoyl cysteine""; /evidence=""ECO:0000250|UniProtKB:Q01629"""
Q99JI6,reviewed,RAP1B_MOUSE,Ras-related protein Rap-1b (EC 3.6.5.2) (GTP-binding protein smg p21B),Rap1b,Mus musculus (Mouse),184,"LIPID 181; /note=""S-geranylgeranyl cysteine""; /evidence=""ECO:0000250|UniProtKB:P61224"""
Q99JX3,reviewed,GORS2_MOUSE,Golgi reassembly-stacking protein 2 (GRS2) (Golgi reassembly-stacking protein of 55 kDa) (GRASP55),Gorasp2,Mus musculus (Mouse),451,"LIPID 2; /note=""N-myristoyl glycine""; /evidence=""ECO:0000250|UniProtKB:Q9H8Y8"""
Q99LX0,reviewed,PARK7_MOUSE,"Parkinson disease protein 7 homolog (Maillard deglycase) (Parkinsonism-associated deglycase) (Protein DJ-1) (DJ-1) (Protein/nucleic acid deglycase DJ-1) (EC 3.1.2.-, EC 3.5.1.-, EC 3.5.1.124)",Park7,Mus musculus (Mouse),189,"LIPID 46; /note=""S-palmitoyl cysteine""; /evidence=""ECO:0000250|UniProtKB:Q99497""; LIPID 53; /note=""S-palmitoyl cysteine""; /evidence=""ECO:0000250|UniProtKB:Q99497""; LIPID 106; /note=""S-palmitoyl cysteine; alternate""; /evidence=""ECO:0000250|UniProtKB:Q99497"""
Q99MH6,reviewed,NKD1_MOUSE,Protein naked cuticle homolog 1 (Naked-1) (mNkd) (mNkd1),Nkd1,Mus musculus (Mouse),471,"LIPID 2; /note=""N-myristoyl glycine""; /evidence=""ECO:0000250"""
Q99N11,reviewed,DUS22_MOUSE,Dual specificity protein phosphatase 22 (EC 3.1.3.16) (EC 3.1.3.48) (Low molecular weight dual specificity phosphatase 2) (LMW-DSP2),Dusp22,Mus musculus (Mouse),184,"LIPID 2; /note=""N-myristoyl glycine""; /evidence=""ECO:0000250"""
Q99NF2,reviewed,NSMF_MOUSE,NMDA receptor synaptonuclear signaling and neuronal migration factor (Juxtasynaptic attractor of caldendrin on dendritic boutons protein) (Jacob protein) (Nasal embryonic luteinizing hormone-releasing hormone factor) (Nasal embryonic LHRH factor),Nsmf Jac Nelf,Mus musculus (Mouse),532,"LIPID 2; /note=""N-myristoyl glycine""; /evidence=""ECO:0000250"""
Q99P58,reviewed,RB27B_MOUSE,Ras-related protein Rab-27B (EC 3.6.5.2),Rab27b,Mus musculus (Mouse),218,"LIPID 216; /note=""S-geranylgeranyl cysteine""; /evidence=""ECO:0000250""; LIPID 218; /note=""S-geranylgeranyl cysteine""; /evidence=""ECO:0000250"""
Q99PE8,reviewed,ABCG5_MOUSE,ATP-binding cassette sub-family G member 5 (EC 7.6.2.-) (Sterolin-1),Abcg5,Mus musculus (Mouse),652,"LIPID 61; /note=""S-palmitoyl cysteine""; /evidence=""ECO:0000269|PubMed:18402465"""
Q99PI8,reviewed,RTN4R_MOUSE,Reticulon-4 receptor (Nogo receptor) (NgR) (Nogo-66 receptor) (Nogo66 receptor-1) (NgR1),Rtn4r Ngr1 Nogor,Mus musculus (Mouse),473,"LIPID 447; /note=""GPI-anchor amidated serine""; /evidence=""ECO:0000255"""
Q9CPU4,reviewed,MGST3_MOUSE,"Glutathione S-transferase 3, mitochondrial (EC 2.5.1.-) (Glutathione peroxidase MGST3) (EC 1.11.1.-) (LTC4 synthase MGST3) (EC 4.4.1.20)",Mgst3,Mus musculus (Mouse),153,"LIPID 151; /note=""S-palmitoyl cysteine""; /evidence=""ECO:0000250|UniProtKB:O14880"""
Q9CPV7,reviewed,ZDHC6_MOUSE,Palmitoyltransferase ZDHHC6 (EC 2.3.1.225) (Stearoyltransferase ZDHHC6) (EC 2.3.1.-) (Zinc finger DHHC domain-containing protein 6) (DHHC-6),Zdhhc6,Mus musculus (Mouse),413,"LIPID 328; /note=""S-palmitoyl cysteine""; /evidence=""ECO:0000250|UniProtKB:Q9H6R6""; LIPID 329; /note=""S-palmitoyl cysteine""; /evidence=""ECO:0000250|UniProtKB:Q9H6R6""; LIPID 343; /note=""S-palmitoyl cysteine""; /evidence=""ECO:0000250|UniProtKB:Q9H6R6"""
Q9CQ10,reviewed,CHMP3_MOUSE,Charged multivesicular body protein 3 (Chromatin-modifying protein 3) (Vacuolar protein sorting-associated protein 24),Chmp3 Vps24,Mus musculus (Mouse),224,"LIPID 2; /note=""N-myristoyl glycine""; /evidence=""ECO:0000255"""
Q9CQ22,reviewed,LTOR1_MOUSE,Ragulator complex protein LAMTOR1 (Late endosomal/lysosomal adaptor and MAPK and MTOR activator 1) (Lipid raft adaptor protein p18),Lamtor1,Mus musculus (Mouse),161,"LIPID 2; /note=""N-myristoyl glycine""; /evidence=""ECO:0000269|PubMed:30020076""; LIPID 3; /note=""S-palmitoyl cysteine""; /evidence=""ECO:0000250|UniProtKB:Q6IAA8""; LIPID 4; /note=""S-palmitoyl cysteine""; /evidence=""ECO:0000250|UniProtKB:Q6IAA8"""
Q9CQD1,reviewed,RAB5A_MOUSE,Ras-related protein Rab-5A (EC 3.6.5.2),Rab5a nnyRab5a,Mus musculus (Mouse),215,"LIPID 212; /note=""S-geranylgeranyl cysteine""; /evidence=""ECO:0000250|UniProtKB:P20339""; LIPID 213; /note=""S-geranylgeranyl cysteine""; /evidence=""ECO:0000250|UniProtKB:P20339"""
Q9CQV6,reviewed,MLP3B_MOUSE,Microtubule-associated proteins 1A/1B light chain 3B (Autophagy-related protein LC3 B) (Autophagy-related ubiquitin-like modifier LC3 B) (MAP1 light chain 3-like protein 2) (MAP1A/MAP1B light chain 3 B) (MAP1A/MAP1B LC3 B) (Microtubule-associated protein 1 light chain 3 beta),Map1lc3b Map1alc3 Map1lc3,Mus musculus (Mouse),125,"LIPID 120; /note=""Phosphatidylethanolamine amidated glycine; alternate""; /evidence=""ECO:0000250|UniProtKB:Q9GZQ8""; LIPID 120; /note=""Phosphatidylserine amidated glycine; alternate""; /evidence=""ECO:0000250|UniProtKB:Q9GZQ8"""
Q9CQW1,reviewed,YKT6_MOUSE,Synaptobrevin homolog YKT6 (EC 2.3.1.-),Ykt6,Mus musculus (Mouse),198,"LIPID 194; /note=""S-palmitoyl cysteine""; /evidence=""ECO:0000250""; LIPID 195; /note=""S-farnesyl cysteine""; /evidence=""ECO:0000250"""
Q9CQW9,reviewed,IFM3_MOUSE,Interferon-induced transmembrane protein 3 (Dispanin subfamily A member 2b) (DSPA2b) (Fragilis protein) (Interferon-inducible protein 15) (Mouse ifitm-like protein 1) (Mil-1),Ifitm3,Mus musculus (Mouse),137,"LIPID 71; /note=""S-palmitoyl cysteine""; /evidence=""ECO:0000250|UniProtKB:Q01628""; LIPID 72; /note=""S-palmitoyl cysteine""; /evidence=""ECO:0000250|UniProtKB:Q01628""; LIPID 105; /note=""S-palmitoyl cysteine""; /evidence=""ECO:0000250|UniProtKB:Q01628"""
Q9CRB9,reviewed,MIC19_MOUSE,MICOS complex subunit Mic19 (Coiled-coil-helix-coiled-coil-helix domain-containing protein 3),Chchd3 Mic19,Mus musculus (Mouse),227,"LIPID 2; /note=""N-myristoyl glycine""; /evidence=""ECO:0000269|PubMed:21081504"""
Q9CW42,reviewed,MARC1_MOUSE,Mitochondrial amidoxime-reducing component 1 (mARC1) (EC 1.7.-.-) (Molybdenum cofactor sulfurase C-terminal domain-containing protein 1) (MOSC domain-containing protein 1) (Moco sulfurase C-terminal domain-containing protein 1),Mtarc1 Marc1 Mosc1,Mus musculus (Mouse),340,"LIPID 2; /note=""N-myristoyl glycine""; /evidence=""ECO:0000250|UniProtKB:Q5VT66"""
Q9CWP4,reviewed,LY6K_MOUSE,Lymphocyte antigen 6K (Ly-6K),Ly6k,Mus musculus (Mouse),154,"LIPID 123; /note=""GPI-anchor amidated glycine""; /evidence=""ECO:0000255"""
Q9CZA6,reviewed,NDE1_MOUSE,Nuclear distribution protein nudE homolog 1 (NudE) (mNudE),Nde1 Nude,Mus musculus (Mouse),344,"LIPID 274; /note=""S-palmitoyl cysteine; by ZDHHC2, ZDHHC3 and ZDHHC7""; /evidence=""ECO:0000250"""
Q9CZE3,reviewed,RAB32_MOUSE,Ras-related protein Rab-32,Rab32,Mus musculus (Mouse),223,"LIPID 222; /note=""S-geranylgeranyl cysteine""; /evidence=""ECO:0000250|UniProtKB:P05713""; LIPID 223; /note=""S-geranylgeranyl cysteine""; /evidence=""ECO:0000250|UniProtKB:P05713"""
Q9CZM2,reviewed,RL15_MOUSE,Large ribosomal subunit protein eL15 (60S ribosomal protein L15),Rpl15,Mus musculus (Mouse),204,"LIPID 2; /note=""N-myristoyl glycine""; /evidence=""ECO:0000250|UniProtKB:P61313"""
Q9CZT8,reviewed,RAB3B_MOUSE,Ras-related protein Rab-3B,Rab3b,Mus musculus (Mouse),219,"LIPID 217; /note=""S-geranylgeranyl cysteine""; /evidence=""ECO:0000250""; LIPID 219; /note=""S-geranylgeranyl cysteine""; /evidence=""ECO:0000250"""
Q9D074,reviewed,MGRN1_MOUSE,E3 ubiquitin-protein ligase MGRN1 (EC 2.3.2.27) (Mahogunin RING finger protein 1) (RING-type E3 ubiquitin transferase MGRN1),Mgrn1 Kiaa0544,Mus musculus (Mouse),532,"LIPID 2; /note=""N-myristoyl glycine""; /evidence=""ECO:0000250"""
Q9D0J4,reviewed,ARL2_MOUSE,ADP-ribosylation factor-like protein 2,Arl2,Mus musculus (Mouse),184,"LIPID 2; /note=""N-myristoyl glycine""; /evidence=""ECO:0000255"""
Q9D103,reviewed,IFM1_MOUSE,Interferon-induced transmembrane protein 1 (Dispanin subfamily A member 2a) (DSPA2a) (Fragilis protein 2) (Mouse ifitm-like protein 2) (Mil-2),Ifitm1,Mus musculus (Mouse),106,"LIPID 49; /note=""S-palmitoyl cysteine""; /evidence=""ECO:0000250|UniProtKB:P13164""; LIPID 50; /note=""S-palmitoyl cysteine""; /evidence=""ECO:0000250|UniProtKB:P13164""; LIPID 83; /note=""S-palmitoyl cysteine""; /evidence=""ECO:0000250|UniProtKB:P13164"""
Q9D1G1,reviewed,RAB1B_MOUSE,Ras-related protein Rab-1B (EC 3.6.5.2),Rab1b,Mus musculus (Mouse),201,"LIPID 200; /note=""S-geranylgeranyl cysteine""; /evidence=""ECO:0000250""; LIPID 201; /note=""S-geranylgeranyl cysteine""; /evidence=""ECO:0000250"""
Q9D1N2,reviewed,HDBP1_MOUSE,Glycosylphosphatidylinositol-anchored high density lipoprotein-binding protein 1 (GPI-HBP1) (GPI-anchored HDL-binding protein 1) (High density lipoprotein-binding protein 1),Gpihbp1 Hbp1,Mus musculus (Mouse),228,"LIPID 198; /note=""GPI-anchor amidated glycine""; /evidence=""ECO:0000305|PubMed:12496272"""
Q9D1N4,reviewed,MYMK_MOUSE,Protein myomaker (Myoblast fusion maker) (Transmembrane protein 8C),Mymk Tmem8c,Mus musculus (Mouse),221,"LIPID 217; /note=""S-palmitoyl cysteine""; /evidence=""ECO:0000305|PubMed:28860190""; LIPID 218; /note=""S-palmitoyl cysteine""; /evidence=""ECO:0000305|PubMed:28860190"""
Q9D1X0,reviewed,NOL3_MOUSE,Nucleolar protein 3 (Apoptosis repressor with CARD),Nol3 Arc,Mus musculus (Mouse),220,"LIPID 2; /note=""N-myristoyl glycine""; /evidence=""ECO:0000250|UniProtKB:O60936"""
Q9D3G9,reviewed,RHOH_MOUSE,Rho-related GTP-binding protein RhoH,Rhoh Arhh,Mus musculus (Mouse),191,"LIPID 188; /note=""S-geranylgeranyl cysteine""; /evidence=""ECO:0000250"""
Q9D4B1,reviewed,SMS2_MOUSE,Phosphatidylcholine:ceramide cholinephosphotransferase 2 (EC 2.7.8.27) (Sphingomyelin synthase 2),Sgms2,Mus musculus (Mouse),365,"LIPID 331; /note=""S-palmitoyl cysteine""; /evidence=""ECO:0000250""; LIPID 332; /note=""S-palmitoyl cysteine""; /evidence=""ECO:0000250""; LIPID 343; /note=""S-palmitoyl cysteine""; /evidence=""ECO:0000250""; LIPID 348; /note=""S-palmitoyl cysteine""; /evidence=""ECO:0000250"""
Q9D658,reviewed,TP4A3_MOUSE,Protein tyrosine phosphatase type IVA 3 (EC 3.1.3.48) (Protein-tyrosine phosphatase 4a3) (Protein-tyrosine phosphatase of regenerating liver 3) (PRL-3),Ptp4a3 Prl3,Mus musculus (Mouse),173,"LIPID 170; /note=""S-farnesyl cysteine""; /evidence=""ECO:0000250"""
Q9D6Y7,reviewed,MSRA_MOUSE,Mitochondrial peptide methionine sulfoxide reductase (EC 1.8.4.11) (Peptide-methionine (S)-S-oxide reductase) (Peptide Met(O) reductase) (Protein-methionine-S-oxide reductase) (PMSR),Msra,Mus musculus (Mouse),233,"LIPID Q9D6Y7-2:2; /note=""N-myristoyl glycine""; /evidence=""ECO:0000269|PubMed:20368336"""
Q9D7S0,reviewed,LYPD8_MOUSE,Ly6/PLAUR domain-containing protein 8,Lypd8,Mus musculus (Mouse),255,"LIPID 233; /note=""GPI-anchor amidated serine""; /evidence=""ECO:0000255"""
Q9D8B7,reviewed,JAM3_MOUSE,Junctional adhesion molecule C (JAM-C) (JAM-2) (Junctional adhesion molecule 3) (JAM-3) [Cleaved into: Soluble form of JAM-C (sJAM-C)],Jam3,Mus musculus (Mouse),310,"LIPID 264; /note=""S-palmitoyl cysteine""; /evidence=""ECO:0000250|UniProtKB:Q9BX67""; LIPID 265; /note=""S-palmitoyl cysteine""; /evidence=""ECO:0000250|UniProtKB:Q9BX67"""
Q9D9R0,reviewed,RN125_MOUSE,E3 ubiquitin-protein ligase RNF125 (EC 2.3.2.27) (RING finger protein 125),Rnf125,Mus musculus (Mouse),233,"LIPID 2; /note=""N-myristoyl glycine""; /evidence=""ECO:0000250|UniProtKB:Q96EQ8"""
Q9DA79,reviewed,DPEP3_MOUSE,Dipeptidase 3 (Membrane-bound dipeptidase 3) (MBD-3) (Protein expressed in male leptotene and zygotene spermatocytes 136) (MLZ-136),Dpep3 Mbd3,Mus musculus (Mouse),493,"LIPID 462; /note=""GPI-anchor amidated serine""; /evidence=""ECO:0000255"""
Q9DBQ7,reviewed,PACE1_MOUSE,Protein-associating with the carboxyl-terminal domain of ezrin (Ezrin-binding protein PACE-1) (SCY1-like protein 3),Scyl3 Pace1,Mus musculus (Mouse),735,"LIPID 2; /note=""N-myristoyl glycine""; /evidence=""ECO:0000250"""
Q9DC51,reviewed,GNAI3_MOUSE,Guanine nucleotide-binding protein G(i) subunit alpha-3 (G(i) alpha-3),Gnai3,Mus musculus (Mouse),354,"LIPID 2; /note=""N-myristoyl glycine""; /evidence=""ECO:0000250|UniProtKB:P08754""; LIPID 3; /note=""S-palmitoyl cysteine""; /evidence=""ECO:0000250"""
Q9DCD6,reviewed,GBRAP_MOUSE,Gamma-aminobutyric acid receptor-associated protein (GABA(A) receptor-associated protein),Gabarap,Mus musculus (Mouse),117,"LIPID 116; /note=""Phosphatidylethanolamine amidated glycine; alternate""; /evidence=""ECO:0000250|UniProtKB:O95166""; LIPID 116; /note=""Phosphatidylserine amidated glycine; alternate""; /evidence=""ECO:0000250|UniProtKB:O95166"""
Q9DCN2,reviewed,NB5R3_MOUSE,NADH-cytochrome b5 reductase 3 (B5R) (Cytochrome b5 reductase) (EC 1.6.2.2) (Diaphorase-1),Cyb5r3 Dia1,Mus musculus (Mouse),301,"LIPID 2; /note=""N-myristoyl glycine""; /evidence=""ECO:0000250|UniProtKB:P00387"""
Q9DCW2,reviewed,PLS2_MOUSE,Phospholipid scramblase 2 (PL scramblase 2) (Ca(2+)-dependent phospholipid scramblase 2),Plscr2,Mus musculus (Mouse),307,"LIPID 182; /note=""S-palmitoyl cysteine""; /evidence=""ECO:0000250|UniProtKB:O15162""; LIPID 183; /note=""S-palmitoyl cysteine""; /evidence=""ECO:0000250|UniProtKB:O15162""; LIPID 186; /note=""S-palmitoyl cysteine""; /evidence=""ECO:0000250|UniProtKB:O15162""; LIPID 187; /note=""S-palmitoyl cysteine""; /evidence=""ECO:0000250|UniProtKB:O15162"""
Q9DD03,reviewed,RAB13_MOUSE,Ras-related protein Rab-13,Rab13,Mus musculus (Mouse),202,"LIPID 199; /note=""S-geranylgeranyl cysteine""; /evidence=""ECO:0000250|UniProtKB:P51153"""
Q9EPK2,reviewed,XRP2_MOUSE,Protein XRP2,Rp2 Rp2h,Mus musculus (Mouse),347,"LIPID 2; /note=""N-myristoyl glycine""; /evidence=""ECO:0000250|UniProtKB:O75695""; LIPID 3; /note=""S-palmitoyl cysteine""; /evidence=""ECO:0000250"""
Q9EPU5,reviewed,TNR21_MOUSE,Tumor necrosis factor receptor superfamily member 21 (Death receptor 6) (CD antigen CD358),Tnfrsf21 Dr6,Mus musculus (Mouse),655,"LIPID 368; /note=""S-palmitoyl cysteine""; /evidence=""ECO:0000250"""
Q9EQ09,reviewed,OLR1_MOUSE,"Oxidized low-density lipoprotein receptor 1 (Ox-LDL receptor 1) (Lectin-like oxidized LDL receptor 1) (LOX-1) (Lectin-like oxLDL receptor 1) (Lectin-type oxidized LDL receptor 1) [Cleaved into: Oxidized low-density lipoprotein receptor 1, soluble form]",Olr1 Lox1,Mus musculus (Mouse),363,"LIPID 45; /note=""S-palmitoyl cysteine""; /evidence=""ECO:0000250"""
Q9EQ31,reviewed,LPAR3_MOUSE,Lysophosphatidic acid receptor 3 (LPA receptor 3) (LPA-3) (Lysophosphatidic acid receptor Edg-7),Lpar3 Edg7 Lpa3,Mus musculus (Mouse),354,"LIPID 309; /note=""S-palmitoyl cysteine""; /evidence=""ECO:0000250"""
Q9EQF4,reviewed,JUNO_MOUSE,Sperm-egg fusion protein Juno (Folate receptor 4) (Folate receptor delta) (FR-delta) (Folate-binding protein 3) (IZUMO1 receptor protein JUNO),Izumo1r Folbp3 Folr4 Juno,Mus musculus (Mouse),244,"LIPID 222; /note=""GPI-anchor amidated glycine""; /evidence=""ECO:0000255"""
Q9EQR5,reviewed,LIME1_MOUSE,Lck-interacting transmembrane adapter 1 (Lck-interacting molecule),Lime1 Lime,Mus musculus (Mouse),269,"LIPID 28; /note=""S-palmitoyl cysteine""; /evidence=""ECO:0000305|PubMed:14610044""; LIPID 31; /note=""S-palmitoyl cysteine""; /evidence=""ECO:0000305|PubMed:14610044"""
Q9EQT3,reviewed,RHOU_MOUSE,Rho-related GTP-binding protein RhoU (Rho GTPase-like protein ARHU) (Wnt-1 responsive Cdc42 homolog 1) (WRCH-1),Rhou Arhu G28k Wrch1,Mus musculus (Mouse),261,"LIPID 259; /note=""S-palmitoyl cysteine""; /evidence=""ECO:0000250|UniProtKB:Q7L0Q8"""
Q9EQX0,reviewed,GHRL_MOUSE,Appetite-regulating hormone (Growth hormone secretagogue) (Growth hormone-releasing peptide) (Motilin-related peptide) (Protein M46) [Cleaved into: Ghrelin; Obestatin],Ghrl Mtlrp,Mus musculus (Mouse),117,"LIPID 26; /note=""O-decanoyl serine; alternate""; /evidence=""ECO:0000269|PubMed:15677766, ECO:0000269|PubMed:15746259""; LIPID 26; /note=""O-hexanoyl serine; alternate""; /evidence=""ECO:0000269|PubMed:15677766""; LIPID 26; /note=""O-octanoyl serine; alternate""; /evidence=""ECO:0000269|PubMed:15677766, ECO:0000269|PubMed:15746259, ECO:0000269|PubMed:18443287"""
Q9ER63,reviewed,TNR23_MOUSE,Tumor necrosis factor receptor superfamily member 23 (Decoy TRAIL receptor 1) (TNF receptor family member SOB) (TNF receptor homolog 1) (Tumor necrosis factor receptor p60 homolog 1),Tnfrsf23 Dctrailr1 Tnfrh1 Tnfrsf1al1,Mus musculus (Mouse),176,"LIPID 155; /note=""GPI-anchor amidated cysteine""; /evidence=""ECO:0000255"""
Q9ER71,reviewed,RHOJ_MOUSE,Rho-related GTP-binding protein RhoJ (Tc10-like GTP-binding protein),Rhoj Arhj Rhoi Rhot Tc10l Tcl,Mus musculus (Mouse),214,"LIPID 3; /note=""S-palmitoyl cysteine""; /evidence=""ECO:0000250|UniProtKB:Q9H4E5""; LIPID 11; /note=""S-palmitoyl cysteine""; /evidence=""ECO:0000250|UniProtKB:Q9H4E5""; LIPID 211; /note=""S-farnesyl cysteine""; /evidence=""ECO:0000250|UniProtKB:P62745"""
Q9ERI2,reviewed,RB27A_MOUSE,Ras-related protein Rab-27A (EC 3.6.5.2),Rab27a,Mus musculus (Mouse),221,"LIPID 219; /note=""S-geranylgeranyl cysteine""; /evidence=""ECO:0000250""; LIPID 221; /note=""S-geranylgeranyl cysteine""; /evidence=""ECO:0000250"""
Q9ERR1,reviewed,NDEL1_MOUSE,Nuclear distribution protein nudE-like 1 (Protein mNudE-like) (Protein Nudel) (mNudE-L),Ndel1 Nudel,Mus musculus (Mouse),345,"LIPID 273; /note=""S-palmitoyl cysteine; by ZDHHC2, ZDHHC3 and ZDHHC7""; /evidence=""ECO:0000250"""
Q9JHI0,reviewed,MMP19_MOUSE,Matrix metalloproteinase-19 (MMP-19) (EC 3.4.24.-) (Matrix metalloproteinase RASI),Mmp19 Rasi,Mus musculus (Mouse),527,"LIPID 512; /note=""GPI-anchor amidated aspartate""; /evidence=""ECO:0000255"""
Q9JHJ7,reviewed,TEST_MOUSE,Testisin (EC 3.4.21.-) (Serine protease 21) (Tryptase 4),Prss21,Mus musculus (Mouse),324,"LIPID 298; /note=""GPI-anchor amidated asparagine""; /evidence=""ECO:0000255"""
Q9JHL0,reviewed,NTAL_MOUSE,Linker for activation of T-cells family member 2 (Linker for activation of B-cells) (Membrane-associated adapter molecule) (Non-T-cell activation linker) (Williams-Beuren syndrome chromosomal region 15 protein homolog),Lat2 Lab Ntal Wbscr15 Wbscr5,Mus musculus (Mouse),203,"LIPID 26; /note=""S-palmitoyl cysteine""; /evidence=""ECO:0000250""; LIPID 29; /note=""S-palmitoyl cysteine""; /evidence=""ECO:0000250"""
Q9JI58,reviewed,RAE1D_MOUSE,Retinoic acid early-inducible protein 1-delta (RAE-1-delta),Raet1d,Mus musculus (Mouse),249,"LIPID 225; /note=""GPI-anchor amidated serine""; /evidence=""ECO:0000255"""
Q9JII1,reviewed,INP5E_MOUSE,"Phosphatidylinositol polyphosphate 5-phosphatase type IV (72 kDa inositol polyphosphate 5-phosphatase) (Inositol polyphosphate-5-phosphatase E) (Phosphatidylinositol 4,5-bisphosphate 5-phosphatase) (EC 3.1.3.36) (Phosphatidylinositol-3,4,5-trisphosphate 5-phosphatase) (EC 3.1.3.86)",Inpp5e,Mus musculus (Mouse),647,"LIPID 644; /note=""S-farnesyl cysteine""; /evidence=""ECO:0000250|UniProtKB:Q9NRR6"""
Q9JIW9,reviewed,RALB_MOUSE,Ras-related protein Ral-B (EC 3.6.5.2),Ralb,Mus musculus (Mouse),206,"LIPID 203; /note=""S-geranylgeranyl cysteine""; /evidence=""ECO:0000250"""
Q9JIZ9,reviewed,PLS3_MOUSE,Phospholipid scramblase 3 (PL scramblase 3) (Ca(2+)-dependent phospholipid scramblase 3),Plscr3,Mus musculus (Mouse),296,"LIPID 159; /note=""S-palmitoyl cysteine""; /evidence=""ECO:0000269|PubMed:21785166""; LIPID 161; /note=""S-palmitoyl cysteine""; /evidence=""ECO:0000269|PubMed:21785166""; LIPID 163; /note=""S-palmitoyl cysteine""; /evidence=""ECO:0000269|PubMed:21785166""; LIPID 164; /note=""S-palmitoyl cysteine""; /evidence=""ECO:0000269|PubMed:21785166""; LIPID 166; /note=""S-palmitoyl cysteine""; /evidence=""ECO:0000269|PubMed:21785166"""
Q9JJ00,reviewed,PLS1_MOUSE,Phospholipid scramblase 1 (PL scramblase 1) (Ca(2+)-dependent phospholipid scramblase 1) (Mg(2+)-dependent nuclease) (EC 3.1.-.-) (Transplantability-associated protein 1) (NOR1) (TRA1),Plscr1 Tra1b Tras1,Mus musculus (Mouse),328,"LIPID 193; /note=""S-palmitoyl cysteine""; /evidence=""ECO:0000250|UniProtKB:O15162""; LIPID 194; /note=""S-palmitoyl cysteine""; /evidence=""ECO:0000250|UniProtKB:O15162""; LIPID 197; /note=""S-palmitoyl cysteine""; /evidence=""ECO:0000250|UniProtKB:O15162""; LIPID 198; /note=""S-palmitoyl cysteine""; /evidence=""ECO:0000250|UniProtKB:O15162"""
Q9JJ69,reviewed,KCIP2_MOUSE,Kv channel-interacting protein 2 (KChIP2) (A-type potassium channel modulatory protein 2) (Potassium channel-interacting protein 2),Kcnip2 Kchip2,Mus musculus (Mouse),270,"LIPID 45; /note=""S-palmitoyl cysteine""; /evidence=""ECO:0000250|UniProtKB:Q9JM59""; LIPID 46; /note=""S-palmitoyl cysteine""; /evidence=""ECO:0000250|UniProtKB:Q9JM59"""
Q9JJT2,reviewed,GFRA4_MOUSE,GDNF family receptor alpha-4 (GDNF receptor alpha-4) (GDNFR-alpha-4) (GFR-alpha-4) (Persephin receptor),Gfra4,Mus musculus (Mouse),260,"LIPID 237; /note=""GPI-anchor amidated threonine""; /evidence=""ECO:0000255"""
Q9JJY3,reviewed,NSMA2_MOUSE,Sphingomyelin phosphodiesterase 3 (EC 3.1.4.12) (Neutral sphingomyelinase 2) (nSMase-2) (nSMase2) (Neutral sphingomyelinase II),Smpd3,Mus musculus (Mouse),655,"LIPID 53; /note=""S-palmitoyl cysteine""; /evidence=""ECO:0000269|PubMed:17272284""; LIPID 54; /note=""S-palmitoyl cysteine""; /evidence=""ECO:0000269|PubMed:17272284""; LIPID 59; /note=""S-palmitoyl cysteine""; /evidence=""ECO:0000269|PubMed:17272284""; LIPID 395; /note=""S-palmitoyl cysteine""; /evidence=""ECO:0000269|PubMed:17272284""; LIPID 396; /note=""S-palmitoyl cysteine""; /evidence=""ECO:0000269|PubMed:17272284"""
Q9JKL5,reviewed,CHP3_MOUSE,Calcineurin B homologous protein 3 (Tescalcin) (TE-1) (TSC),Tesc Chp3,Mus musculus (Mouse),214,"LIPID 2; /note=""N-myristoyl glycine""; /evidence=""ECO:0000250|UniProtKB:Q96BS2"""
Q9JL06,reviewed,LPAR2_MOUSE,Lysophosphatidic acid receptor 2 (LPA receptor 2) (LPA-2) (Lysophosphatidic acid receptor Edg-4),Lpar2 Edg4 Lpa2,Mus musculus (Mouse),348,"LIPID 308; /note=""S-palmitoyl cysteine""; /evidence=""ECO:0000250"""
Q9JL26,reviewed,FMNL1_MOUSE,Formin-like protein 1 (Formin-related protein),Fmnl1 Frl Frl1,Mus musculus (Mouse),1094,"LIPID 2; /note=""N-myristoyl glycine""; /evidence=""ECO:0000250|UniProtKB:O95466"""
Q9JLK4,reviewed,CABP2_MOUSE,Calcium-binding protein 2 (CaBP2),Cabp2,Mus musculus (Mouse),216,"LIPID 2; /note=""N-myristoyl glycine""; /evidence=""ECO:0000250"""
Q9JLK7,reviewed,CABP1_MOUSE,Calcium-binding protein 1 (CaBP1),Cabp1,Mus musculus (Mouse),227,"LIPID 2; /note=""N-myristoyl glycine""; /evidence=""ECO:0000250|UniProtKB:Q9NZU7""; LIPID 4; /note=""S-palmitoyl cysteine""; /evidence=""ECO:0000250|UniProtKB:Q9NZU7""; LIPID Q9JLK7-2:2; /note=""N-myristoyl glycine""; /evidence=""ECO:0000305""; LIPID Q9JLK7-2:4; /note=""S-palmitoyl cysteine""; /evidence=""ECO:0000305"""
Q9JMB8,reviewed,CNTN6_MOUSE,Contactin-6 (Neural recognition molecule NB-3) (mNB-3),Cntn6,Mus musculus (Mouse),1028,"LIPID 999; /note=""GPI-anchor amidated serine""; /evidence=""ECO:0000255"""
Q9JMI7,reviewed,TX101_MOUSE,Testis-expressed protein 101 (TES101-reactive protein) (TES101RP),Tex101,Mus musculus (Mouse),250,"LIPID 224; /note=""GPI-anchor amidated glycine""; /evidence=""ECO:0000255"""
Q9QUG3,reviewed,PRND_MOUSE,Prion-like protein doppel (Doppelganger) (Dpl) (PrPLP),Prnd,Mus musculus (Mouse),179,"LIPID 155; /note=""GPI-anchor amidated glycine""; /evidence=""ECO:0000305|PubMed:10842180"""
Q9QUI0,reviewed,RHOA_MOUSE,Transforming protein RhoA (EC 3.6.5.2),Rhoa Arha Arha2,Mus musculus (Mouse),193,"LIPID 190; /note=""S-geranylgeranyl cysteine""; /evidence=""ECO:0000250|UniProtKB:P61585"""
Q9QUR8,reviewed,SEM7A_MOUSE,Semaphorin-7A (Semaphorin-K1) (Sema K1) (Semaphorin-L) (Sema L) (CD antigen CD108),Sema7a Cd108 Semal Semk1,Mus musculus (Mouse),664,"LIPID 646; /note=""GPI-anchor amidated alanine""; /evidence=""ECO:0000255"""
